{
  "intended_action": "create minimal local operator UX shell",
  "executed_action": "wrote static UX files under <repo-root>/runtime/operator_ux/",
  "observed_outcome": "Readback confirmed index.html exists and visibly contains Task ID, User request / task goal, Route class, Gate decision, Side effect status, Approval required?, Allowed scope, Forbidden scope, Evidence handles, Verification status, Completion claim allowed?, Final response checklist, Open loops, and Next hint. Readback confirmed operator_snapshot_task_001.json uses gate_decision \"sandbox_only\" and verification_status \"passed\". No external libraries or network calls were found in index.html.",
  "evidence_handles": [
    "<repo-root>/runtime/operator_ux/index.html",
    "<repo-root>/runtime/operator_ux/operator_snapshot_task_001.json",
    "<repo-root>/runtime/operator_ux/README.md"
  ],
  "verification_status": "passed",
  "confidence": 1.0,
  "failure_reason": ""
}
