{
  "intended_action": "implement canonical monitor module",
  "executed_action": "created runtime/monitor module, preserved core monitor wrapper, and added task-local tests",
  "observed_outcome": "Task 016 monitor module exists, M2 commit evaluation is stricter than M3 mirror exposure, task-local tests passed, and listed regression tests passed without widening scope into Tasks 015/017/018.",
  "evidence_handles": [
    "<repo-root>/runtime/monitor/__init__.py",
    "<repo-root>/runtime/monitor/contracts.py",
    "<repo-root>/runtime/monitor/preflight.py",
    "<repo-root>/runtime/monitor/commit.py",
    "<repo-root>/runtime/monitor/observability.py",
    "<repo-root>/runtime/core/monitor.py",
    "<repo-root>/runtime/core/gate.py",
    "<repo-root>/runtime/contracts/enums.py",
    "<repo-root>/runtime/contracts/types.py",
    "<repo-root>/runtime/tests/test_monitor_module.py",
    "<repo-root>/runtime/task_runs/task_016_canonical_monitor_module/preflight.md",
    "<repo-root>/runtime/task_runs/task_016_canonical_monitor_module/task_run_record.md",
    "<repo-root>/runtime/task_runs/task_016_canonical_monitor_module/verification_record.json",
    "<repo-root>/runtime/task_runs/task_016_canonical_monitor_module/final_response_checklist.md"
  ],
  "verification_status": "passed",
  "confidence": 1.0,
  "failure_reason": ""
}
